type,RelNO,content,Arg1_Content,Arg2_Content
Implicit,5,解释说明,于是事情发生了。。。,下午1点钟，邻居给我打来了电话，说带父母去吃自助餐了，可能到下午3点左右才能回来。
Implicit,5,解释说明,下午1点钟，邻居给我打来了电话，说带父母去吃自助餐了，可能到下午3点左右才能回来。,我当然是答应了，并且让他们不要着急。
Implicit,5,递进,在医院邻居给我看了警察的report，邻居的全责，左转撞了人家直行的truck，我的车全毁，已经被拉走了。,我强忍住失去爱车的悲痛（我是半保）让朋友送这一家几口回了家。
Implicit,4,间接对比,我强忍住失去爱车的悲痛（我是半保）让朋友送这一家几口回了家。,于是噩梦开始了。
Implicit,4,间接对比,于是我也没把他们的话当真，但气还是有的。,没想到第三天的一个电话完全改变了我原先的想法，早上刚准备去上班，电话响了，原以为又是推销的电话，准备应付了事，没想到电话那头传来了一个深成刚毅的中年男子的声音，他用不容置疑的口气说，我的邻居由于借用我的车出了车祸，给他们造成了肉体和精神上的创伤，并且同时损害了他们的经济利益，作为车主，如果我赔付他们的医疗费和误工费（三倍），就可以免予起诉我，否则就法庭上见，并且说他作为一个从业十年的律师，对此案很有把握，如果上庭，他提出的赔付额度可能成倍增加。
Implicit,4,间接对比,没想到第三天的一个电话完全改变了我原先的想法，早上刚准备去上班，电话响了，原以为又是推销的电话，准备应付了事，没想到电话那头传来了一个深成刚毅的中年男子的声音，他用不容置疑的口气说，我的邻居由于借用我的车出了车祸，给他们造成了肉体和精神上的创伤，并且同时损害了他们的经济利益，作为车主，如果我赔付他们的医疗费和误工费（三倍），就可以免予起诉我，否则就法庭上见，并且说他作为一个从业十年的律师，对此案很有把握，如果上庭，他提出的赔付额度可能成倍增加。,堂堂中国男子汉还能被律师的几句话所吓倒？
Implicit,5,解释说明,当然我也请的律师，没想到，我的律师打了两个电话就把事情解决了，一个是打给警察局，问问事故调查报告有没有什么补充，没想到还真有补充，并且对他们很不利。,junkyard的人发现车里有一个没有喝完的并且敞开盖子的酒，并把这一情况告诉了警察局。
Implicit,5,解释说明,junkyard的人发现车里有一个没有喝完的并且敞开盖子的酒，并把这一情况告诉了警察局。,警察发现原来他们吃完饭，把没喝完的酒敞盖放在车里。
Implicit,4,间接对比,于是他们的律师撤诉了。,当然他们不会就此罢休的，又找过我谈过好几次，有甜言蜜语的，也有威胁恐吓的，最经典的一句就是：以后你别想回国混，我们全国都有人。呕！
Implicit,5,解释说明,于是又会到了老话题，邻居朋友向你借车借不借，我想很多人会说不借，在网上我也会建议不要借，但网络毕竟是虚拟的，文字有是每有感情的，当你貌似nice的邻居，看似close的朋友，还有眼睛会说话的mm在现实中向你开口时，又会有多少人会以no来回答呢？,反正我没做到，此后我又把车接给过需要的人，而且我相信，我从前的那位邻居夫妇毕竟还是少数。
Implicit,4,间接对比,事故是一场车祸，许多娱乐新闻指责他的汽车前方安全气囊没有打开，是导致死亡的原因。,其实，她所坐的MINICOOPER不算是报道中说的那样，是安全系数最高的车。
Implicit,5,解释说明,这次批崔“运动”，让我想起了一件往事。,我念初中那会，附近有一个男人死了，不知为什么谣言四起，大家都说是他老婆谋杀亲夫。
Implicit,5,解释说明,我念初中那会，附近有一个男人死了，不知为什么谣言四起，大家都说是他老婆谋杀亲夫。,这个男人自来是老实巴交，女人又一向交际广阔，尽管法医已经验过尸，但是不知是哪里出来这样的说法，男方的家人也坚持开棺再验，这样的事情在我们那个小地方闹得是沸沸扬扬。
Implicit,5,递进,这个女人也真是个厉害角色，不但和厂里的几个大头有些交情，和从厂里调出去的时任市公安局局长也颇为相熟，在开不开棺这个事情上拉扯了很久，终于由于舆论压力太大，又重新验了尸，结果是下毒。,到这时，群众都快沸腾了，为平众怒，最后公审，女的承认了杀夫的罪名。
Implicit,5,递进,大家以为在这样的情况下，一定是死刑了，结果判成了死缓。,过了几年，市公安局长成了省公安厅厅长，然后也有人说，在省会又看到了这个女的。
Implicit,2,推论在先,以前总认为美国的很多法律规定可笑荒诞，但经历过这些以后，觉得还是很有道理的。,为了保护弱者，强势的人牺牲一些利益或便利是应该的。
Implicit,5,递进,每个人都有选择自己大学的原因，因为合肥的生活费便宜，不愿意让父母受累太多，我选择了科大。,多年后回头看看这个选择，我并不因此后悔。
Implicit,2,原因在先,也许如果去了北京的两所学校，不会有今天在这里和人说科大如何，但是科大本来就是弱势，无论是地理经费宣传人脉，科大最大的财富是学生。,我们不出来为科大做什么，科大就完了。
Implicit,5,递进,我们不出来为科大做什么，科大就完了。,这也是科大学生为什么抱团的最大原因。
Implicit,5,递进,因为选择科研做为职业，我因此感谢科大教给我的很多东西，也感谢以前的学长们创下的声誉，让后来者受益。,正因为常怀感激之心，我愿意回报科大。
Implicit,5,递进,正因为常怀感激之心，我愿意回报科大。,平时做好本职工作，不为科大丢脸。
Implicit,5,解释说明,平时做好本职工作，不为科大丢脸。,我愿意从我微薄的奖学金中省钱捐助一个贫困大学生4年的生活费，我愿意回国效力，我也愿意为后来的师弟师妹们提供必要的帮助。
Implicit,5,递进,我愿意从我微薄的奖学金中省钱捐助一个贫困大学生4年的生活费，我愿意回国效力，我也愿意为后来的师弟师妹们提供必要的帮助。,看见科大被人攻击的时候，我有时候愿意花时间辩护，虽然这个没有什么用。
Implicit,5,实例在后,各厂商提供不同的内部支撑特性。,一些厂商使用成型中底，使脚能妥帖地踩踏在鞋内，另外，沿鞋一周的纤维也可提供支撑。
Implicit,5,解释说明,在鞋的寿命好去的一半的时候更换鞋垫，有一个基本的更换原则：进行有氧运动150小时后，鞋垫会失去弹力，这时应更换鞋垫。,可根据不同的人，不同的训练而定
Implicit,5,泛化,＂此外，应经常测量脚的长度，因为年龄的增长及损伤都有可能改变脚的尺寸＂,＂此外，应经常测量脚的长度，因为年龄的增长及损伤都有可能改变脚的尺寸＂
Implicit,4,间接对比,这个强！,不会有朝一日变成三寸金莲吧．
Implicit,5,递进,有人称这段阳历年到阴历年之间的日子为“浮日”--悬浮于新与旧、东西文化之间的日子。,浮日里想得最多的自然是怎么过春节。
Implicit,5,解释说明,今年DC的冬天或者无法令您领略到数九的寒意，可大华府北京同乡会的涮羊肉聚会一定能叫您感受到在家乡过年的气氛。,北京同乡会一年一度涮羊肉迎新春聚会已延续了四、五年，凡是参加过的人，都会对北京同乡会的独门配料记忆犹新，赞不绝口。
Implicit,5,递进,北京同乡会一年一度涮羊肉迎新春聚会已延续了四、五年，凡是参加过的人，都会对北京同乡会的独门配料记忆犹新，赞不绝口。,更令人回味的是贯穿始终的热闹，北京人是出了名爱热闹、爱逗乐儿的。
Implicit,5,解释说明,更令人回味的是贯穿始终的热闹，北京人是出了名爱热闹、爱逗乐儿的。,有北京人在的聚会少有会冷场的，更别说这么多北京人聚到一块儿了。
Implicit,5,解释说明,有北京人在的聚会少有会冷场的，更别说这么多北京人聚到一块儿了。,听不完的笑话、逗不完的乐，到时候，就恨只生了一双耳朵、一张嘴。
Implicit,5,递进,听不完的笑话、逗不完的乐，到时候，就恨只生了一双耳朵、一张嘴。,热腾腾的涮羊肉，再加上这热闹的气氛，保管给您在这本来就不大冷的冬天里更加一层暖到心窝里的乡情。
Implicit,2,原因在先,热腾腾的涮羊肉，再加上这热闹的气氛，保管给您在这本来就不大冷的冬天里更加一层暖到心窝里的乡情。,北京同乡会热烈欢迎全体会员及所有热爱北京、热爱北京同乡会的朋友前来参加金猪送福的新春聚会，我们将会给您快乐与意外惊喜。
Implicit,5,解释说明,地点在大富贵餐馆。,地址如下：19204MontgomeryVillageAve，MontgomeryVillage，MD20886
Implicit,2,原因在先,当今社会，激烈的竞争、文化的冲突和物质的诱惑无时无刻不在扰动着我们的心灵，我们常常感到忧愁、焦躁、不安、愤怒。,人们也尝试用物质的方式进行调整，但往往并不能奏效：健身运动并不能减轻心中的忧虑；旅游归来没多久依然心身疲惫；柔软的水床并不能带来安逸的睡眠；豪华的房间也消除不了夫妻的纷争。
Implicit,2,原因在先,例如，让两人观察同一只杯子，如果一个人注意到微小的斑点，另一个人注意到柔和的色泽，前者的思维模式就可能比较悲观，而后者对事物积极的方面更为敏感，是一种健康、乐观的思维方式。,学习观察事物积极方面就成为一种重要的训练。
Implicit,5,泛化,邮政低卖：前几年邮政大量低价卖出邮票造成的，违反价值规律与邮票收藏规律，大规模地向邮市倾泻打折票张，使50元张，8元张，5元张大大的低于本身的面值，套票的折扣更低。,来源之一也。
Implicit,5,泛化,邮人变现：在1997年，我国的集邮爱好者人数达到最高峰，据估计，当时的集邮爱好者人数大约在2700万之上，邮政部门为了满足广大集邮爱好者的集邮要求，按当时的订票人数印了大量的套票与小型张，近几年，集邮爱好者因各种原因大量地流失，不再收藏邮票了，这些人为了变现，把自己原来收藏的92年至2005年间的邮票在市场上大量地抛售，致使供过于求。,来源之二也。
Implicit,5,泛化,大户抛售：在1997年的邮票炒作中，也有不少的实力大户也把这一期间的票张作为炒作筹码买了回去，现在也为了变现，也在市场上不计成本地抛售。,来源之三也。
Implicit,5,泛化,使用不畅：这些邮票在前几年使用不畅，形成了市场上的大量积压，邮票打折折扣最低时，50元小型张10元即2折上下，8元小型张为2．4元在3折上下，5元小型张在1．8元约是面值的3．6折上下，套票的打折折扣就更低了，就是这个折扣还不一定卖得出去。,来源之四也。
Implicit,5,泛化,新邮过泛：这么多年的新邮发行量大是众所周知的，大家皆知，不用多说。,来源之五也。
Implicit,5,泛化,进一步完善邮政改革，国家邮政局要加强对邮政业务的监督，邮政集团总公司要在监督之下经营，不要再出现违规之事。,去法之一也。
Implicit,5,泛化,这不就自然而然地解决了邮票打折的问题。,去法之二也。
Implicit,5,泛化,回购掉：回购方式有两种：一是政策性回购，就是邮政对打折票（至少是有影响的邮票）采用国家回购的方式处理，从目前来看有点难；二是市场性回购，利用市场经济这个杠杆，采用在市场上底价收购打折较深的邮票再出售给群众用于通信，加快打折邮票的消耗速度，也就是改制后的邮政参与市场运作，减轻打折票的压力，经过一段时间的处理，这个问题是可以很好地解决的，此举不失为一个较实际的办法。,去法之三也。
Implicit,5,泛化,新邮的发行量一定要合乎实际情况，多了不行，少了也不行。,去法之四也。
Implicit,5,解释说明,今天坐地铁去火车站接人，发现地铁站里到处都贴满了红头文件。,仔细一看，原来是关于北京公交票价调整的公告。
Implicit,5,解释说明,具体的内容我没有关心，因为早已有所耳闻，吸引我的是这份公告下面的六个大红公章－发改委，教委，社保局，财政局，交通委，运输管理局。,我大概知道为什么需要前四个机构的公章，发改委就是管价格的机构，教委和社保局对应的人群可能受这项政策变化的影响比较大，财政局是出钱的机构。
Implicit,4,间接对比,我大概知道为什么需要前四个机构的公章，发改委就是管价格的机构，教委和社保局对应的人群可能受这项政策变化的影响比较大，财政局是出钱的机构。,我不知道交通委和运输管理局是什么样的机构，我甚至不知道为什么这两个机构不是一个机构－从名称上看，运输管理局似乎完全可以是交通委的一个部门。
Implicit,5,实例在后,政府的膨胀总是有理由的。,你看，我不费吹灰之力就为这六个公章找到了理由，可我根本就是个局外人，要是让政府部门为自己的存在找理由那岂不是更轻而易举？
Implicit,5,解释说明,政府部门的存在和私人机构的存在是不同的，私人机构是花自己的钱，膨胀得太厉害了是要赔本的。,政府机构花的是纳税人的钱，花再多，只要多得不是离谱，永远不会面临赔本关门的危险。
Implicit,5,解释说明,能自己找到理由膨胀，又能不用担心钱的问题，政府的机构有什么理由会不膨胀呢？,我是有点想不出来。
Implicit,5,解释说明,一个中国公民，加入美军后，战死伊拉克战场上。,他的名字叫——孙明。
Implicit,2,原因在先,一个中国公民，加入美军后，战死伊拉克战场上。,美军给了他极高的荣誉：象征最高荣誉的青铜和紫心勋章。
Implicit,5,解释说明,美军给了他极高的荣誉：象征最高荣誉的青铜和紫心勋章。,铜星和紫心勋章是国防部颁发的仅次于荣誉勋章和银星勋章的最高荣誉，前者专授予英勇作战者，后者只授予在战争中受伤和牺牲的将士。
Implicit,5,解释说明,毛泽东在张思德同志的悼文《为人民服务》中说：“村上的人死了，开个追悼会，用这样的方法，寄托我们的哀思。”,同礼吧，无论孙明是那国的军人，在他死去的那一刻，他依然还是个品行端正的中国公民。
Implicit,2,原因在先,同礼吧，无论孙明是那国的军人，在他死去的那一刻，他依然还是个品行端正的中国公民。,对他的死我表示悲痛，并对他的家人表示真心的问候：节哀顺变。
Implicit,4,间接对比,对他的死我表示悲痛，并对他的家人表示真心的问候：节哀顺变。,现在要说的是，孙明之死到底有多大意义和价值。
Implicit,5,解释说明,在弄清这个问题之前，我们必须先弄清伊拉克战争的性质，是正义的还是非正义的？,如果是正义的，那么无论是对美国而言，还是对中国以至全世界人民而言，孙明的死就是伟大的。
Implicit,2,原因在先,如果是正义的，那么无论是对美国而言，还是对中国以至全世界人民而言，孙明的死就是伟大的。,他就是白求恩那样的国际主义战士，应该被全人类怀念。
Implicit,5,解释说明,从国际法上来讲，凡是没有得到联合国授权的战争，其战争的正义性就有是非之嫌，其战争中战殆者的荣誉称号，就不为世人共认。,说白了，如果进教科书的话，就存在两种可能，一种是，发动战争的国家会把他当作英雄书写，供后人敬仰；一种是，被动接受战争的国家会把他当作反面人物，供后人唾骂。
Implicit,2,原因在先,众所周知，伊拉克战争前后有两次，一次是1991年伊拉克战争，那一次得到了联合国批准，是全世界正义力量对伊拉克侵略主权国家科威特的惩罚。,毋庸置疑，这一次伊拉克战争的性质是正义的。
Implicit,2,原因在先,毋庸置疑，这一次伊拉克战争的性质是正义的。,显然，凡是在这次战争中牺牲的正义一方的军人，他们的死就有全球意义。
Implicit,2,原因在先,而第二次伊拉克战争，也就是现在还打着的伊拉克战争，是美国撇开联合国单干的。,居于这一点，无论那些国家亦或是那些人认为伊拉克该打，都不能成为把这场战争定性为正义之战的理由。
Implicit,5,解释说明,因为感情不代表法律。,这就好比一个十恶不赦的坏蛋，除了法官，任何集体和个人，都没有权力判他的死刑。
Implicit,5,递进,这就好比一个十恶不赦的坏蛋，除了法官，任何集体和个人，都没有权力判他的死刑。,倘或有人手痒，替法官作主了，那便成了杀人犯。
Implicit,5,递进,美国是个很有魅力的国家，当中国公民为了美利坚的利益奉献出生命以后，他毫不吝啬的给了他美国公民的待遇。,一直以加入美国国籍为最大愿望孙明，如九泉有知虽死瞑目了。
Implicit,5,解释说明,比如孙明“烈士”的遗属，美国政府是不是该那个一下子，说白了吧，怎么也得意思意思不是。,总不能给一张“烈士证”给点抚恤金就打发了吧。
Implicit,5,解释说明,尤其是对孙明父亲的话“我希望战争结束得越快越好，我希望布什政府保证美国士兵的安全，不要再伤害任何家庭了。”美国政府是不是该认真地考虑一下呢？,生命是宝贵的，美国更是个热爱生命、珍惜生命的国度。
Implicit,5,递进,生命是宝贵的，美国更是个热爱生命、珍惜生命的国度。,如果一方面高喊生命重于泰山，另一方面又把美国军人派到世界各地去流血牺牲，这二者不就自相矛盾了吗？
Implicit,5,递进,如果一方面高喊生命重于泰山，另一方面又把美国军人派到世界各地去流血牺牲，这二者不就自相矛盾了吗？,又何谈热爱生命、珍惜生命呢？
Implicit,5,解释说明,可冥冥中，又总是有那么一种感觉，就是两个强盗头子为了争地盘火拼罢了。,布什政府是水泊梁山，不经赵诘批准，就打起了“替天行道”的旗帜，今天捣毁了祝家庄，明天灭了曾头市，后天当不住就打大名府了。
Implicit,5,递进,萨达姆政权则是田虎、王庆之流，不杀不足以平民愤。,而孙明的死，跟文忠容和崔野的死不就恰恰一样么，《水浒传》第105回写道：“董平教军士收拾文仲容，崔野二人尸首埋葬。唐斌见折了二人，放声大哭，亲与军士殡殓二人。董平等九人已将兵马屯扎在隆中山的南麓了。次日，宋江等两队大兵都到，与董平等合兵一处。宋江见折了二将，十分凄惨，用礼祭奠毕，与吴用商议攻城之策。”
Implicit,5,解释说明,而孙明的死，跟文忠容和崔野的死不就恰恰一样么，《水浒传》第105回写道：“董平教军士收拾文仲容，崔野二人尸首埋葬。唐斌见折了二人，放声大哭，亲与军士殡殓二人。董平等九人已将兵马屯扎在隆中山的南麓了。次日，宋江等两队大兵都到，与董平等合兵一处。宋江见折了二将，十分凄惨，用礼祭奠毕，与吴用商议攻城之策。”,唐斌和文忠容、崔野皆为田虎旧部，乃战友关系，故放声大哭。
Implicit,5,解释说明,反之，再看看宋江的哥们弟兄们死了他是什么表情，《水浒传》第112回写道：“磨扇打死了“白面郎君”郑天寿；两个中药箭的是“操刀鬼”曹正，“活闪婆”王定六。宋江听得又折了三个兄弟，大哭一声，蓦然倒地，未知五脏如何，先见四肢不举。”,俗话说，亲分远近，人有亲疏。
Implicit,5,解释说明,不过，在中国四川汶川大地震发生一周多以来，人们可以越来越明显地感觉到此次大灾实际上巩固了中国政府的领导。,中国政府对地震做出了快速反应，同时，以国有媒体为主的各家媒体不遗余力地把政府最好的一面展现在了空前团结的中国民众眼前，这一切都有助于提升中央政府的形像，彰显其负责与高效。
Implicit,5,递进,中国政府对地震做出了快速反应，同时，以国有媒体为主的各家媒体不遗余力地把政府最好的一面展现在了空前团结的中国民众眼前，这一切都有助于提升中央政府的形像，彰显其负责与高效。,与此同时，全球在此次灾害面前所表现出的极大同情至少在眼下平息了针对北京在西藏等问题上的批评之声，而此前的种种非难为北京成功主办今夏奥运会蒙上了阴影。
Implicit,5,实例在后,此次里氏７．９级的强震是中国３０年多来所遭遇的最严重的自然灾害，周三时因灾遇难人数仍在增加，营救生还者的努力往往无功而返。,截至发稿时，国有媒体新华社报导仅救出了一名困在一座毁损水电厂管道中的女性幸存者。
Implicit,5,递进,截至发稿时，国有媒体新华社报导仅救出了一名困在一座毁损水电厂管道中的女性幸存者。,对更多生命奇迹的期待恐怕只能以失望收场，因为此次大地震毕竟已经过去了九天时间。
Implicit,5,递进,官方公布的数据显示，截至２１日中午１２时，地震遇难人数已经达到了４１，３５３人，另有３２，６６６人失踪，超过２７０，０００人受伤，其中仍在接受治疗的有将近２６，０００人。,未来数年中国将花费巨资进行灾后重建，并重新安置多达５００万的无家可归的灾民。
Implicit,5,递进,自从今年３月份西藏爆发反政府流血暴乱、中国政府进行镇压之后，外国就一直在谴责中国政府；而今震灾至少是中断了这种负面声音的积聚。,对中国政府态度的转变从西藏流亡政府的表现上就不难看出。
Implicit,5,递进,被北京方面指为西藏骚乱幕后策划者的西藏流亡政府周三表示，它已经指示驻各国官员为灾民组织祈福法会、筹集善款,设在印度达兰萨拉的西藏流亡政府在其官网上表示，居住在世界各地的藏人应该避免到所在地的中国使领馆门前示威抗议。
Implicit,5,解释说明,这和布什政府２００５年应对卡特里娜（Ｋａｔｒｉｎａ）飓风时形成了鲜明对比，许多人都批评美国政府反应迟钝、效率低下。,灾前布什的支持率就因为经济问题和伊拉克战争而表现萎靡，而赈灾不力所引发的公众反感令他的支持率更遭到重挫，至今都没有恢复。
Implicit,5,解释说明,在中国政府上周所采取的迅速行动中，最经常看到的是温家宝总理的身影，他的言行已使他成为了中国人民心中的英雄。,温家宝在地震发生后仅仅几个小时就乘机赶往灾区，在接下来的四天时间里一个接一个地走访受灾乡镇，如果道路受阻就坐直升飞机＆ｑｕｏｔ；空降＆ｑｕｏｔ；灾区，为灾民们带去安慰，并向他们保证政府会提供更多帮助。
Implicit,5,递进,中国国有媒体也对温家宝视察灾区进行了密集报导，随后包括国家主席胡锦涛在内的中国高层领导人接连走访灾区，他们的行程均被广泛报导。,任何对救灾不力的指责似乎都瞄准了当地官员。
Implicit,5,实例在后,任何对救灾不力的指责似乎都瞄准了当地官员。,国有报纸报导称，在邻近震中的旅游城市都江堰，三位本地官员已因救灾不力而遭解职。
Implicit,5,实例在后,周一，一些刚刚经历了丧子之痛的家长哭着站在四川绵竹五福镇第二小学的门口示威，他们表示，校舍质量低劣才是夺取孩子们生命的罪魁祸首，而不是地震灾害。,在地震中失去了１３岁女儿的毕凯维（音）就站在废墟旁，他说，这不是中央政府的错，是本地贪官的问题；我们要严惩这些人。
Implicit,5,实例在后,中国政府在地震发生后第一周给予了本地记者前所未有的报导自由，并因此受到了主张新闻自由团体的称赞。,在每日的新闻发布会上都有若干官员回答记者的提问，他们在回答从伤亡数据到现场救援困难等各类问题时都表现出了少有的坦诚。
Implicit,5,解释说明,不过，有一些迹象表明中国方面这几天已经开始对报导有所限制。,官员们似乎正努力劝阻那些可能对政府形像造成负面影响的报导。
