type,RelNO,content,Arg1_Content,Arg2_Content
Explicit,4,间接对比,所有社区对基础设施都有ＣＩＰ（基建投资计划）－－更换设施以及－－,但是每年的年度预算可以＋包含更换基础设施，就像计算学校系统每年需要更换多少校车一样，
Explicit,2,结果在先,新基础设施不是，,因为它取决于增长率。
Explicit,5,递进,大多数社区不＋愿选择让现有居民承担对新居民所用的新基础设施的经济责任，,也不认为这样是公平的。
Explicit,4,间接对比,虽然瑞典人拥有城市规划方面的技能，对公共交通进行了投资,但是他们似乎正饱受交通拥堵之苦
Explicit,4,间接对比,虽然瑞典的政客是社会主义者,但是他们显然对经济学的掌控要比弗吉尼亚的政客们强
Explicit,6,平行,激光探测仪,和摄像机
Explicit,5,递进,其目标是改变驾车者的行为,而现实情况正是如此
Explicit,5,递进,一些斯德哥尔莫人（斯德哥尔摩人？）不是每天同一时间开车上下班,而正在改变他们的通勤时间
Explicit,6,平行,快速公交路线,和更多停车换乘的场地
Explicit,2,结果在先,照样有人不会买智能标签,因为他们不想让政府（或者他们配偶的离婚律师）获得资料
Explicit,2,结果在先,一些人会更喜欢那个方案,因为它更加便捷
Explicit,6,平行,运行正常的行政,及可持续的文明
Explicit,2,目的在先,为了保护要靠＋保密来维持＋特权的说谎的丈夫、妻子和其他人,他们可以固执地追求私人权利，而排斥公共责任。
Explicit,3,相关条件在先,如果他们没有花这笔钱,试验还会如此成功吗
Explicit,5,递进,斯德哥尔摩的政府能够沉着、公平地推行这个试验,并且允许市民此后废除它，如果他们认为它不值得的话
Explicit,1,先序,哪个美国政府曾经采纳过实验性的政策,然后进行公民投票
Explicit,4,间接对比,犯了错误后,却无法使政府承认它
Explicit,5,递进,斯德哥尔摩的政府完全有从正面宣传此事的动机,而所有的评论看上去都是好的
Explicit,5,递进,那些经济效益过了好一阵的时间才明朗起来,并得以衡量
Explicit,4,间接对比,虽然伦敦的试验也似乎是成功的,但是有很多运动反对它以及随后激增的通行费
Explicit,6,平行,有很多运动反对它,以及随后激增的通行
Explicit,4,间接对比,我郑重声明，我赞成拥堵通行费,但我也认为它会加快淡化中心地区的地位。
Explicit,4,间接对比,在伦敦，拥堵区边界内的商业似乎有明显的下滑,而一出了界外就有显著的上升
Explicit,4,间接对比,隐私权问题是不可否认的,但电子收费的发展趋势也同样如此
Explicit,5,递进,以及红灯违规照相装置,甚至企业中的安保摄像机
Explicit,6,平行,除了拥堵定价之外,电子收费也将使其他车辆出行收费方法变为现实
Explicit,4,间接对比,电子收费提供了一个在做完调研／决定后很快就修建新道路的机会,而不用等待好几年
Explicit,2,目的在后,，而其他那些国家正在整个地区实施电子收费,以此调整整个网络的拥堵
Explicit,3,充分条件在后,那是科技将我们带向何方的逻辑,只要政治问题不挡道
Explicit,6,互斥选择,要么北弗州童子军说对了,要么拉里说对了
Explicit,4,让步在先,即使你修筑新的道路或节制需求,它仍然很高
Explicit,6,相容选择,修筑新的道路,或节制需求
Explicit,3,相关条件在先,如果拉里说的对，拥堵定价调整了该地区,那么一些经济活动没有发生在它本可能发生的地方
Explicit,5,实例在后,但特殊情况除外,比如，耗巨资的桥梁、高度拥堵的地区
Explicit,4,间接对比,我仍然认为没有理由进行收费,但特殊情况除外：比如，耗巨资的桥梁、高度拥堵的地区
Explicit,5,递进,将汽油税设成足以实现其目标的高度仍然是更公平、更便宜的方法,并且更加有利于环境保护
Explicit,3,必要条件,除非弗吉尼亚州摒弃狄龙原则或者弗吉尼亚州北部自成一州,否则这个现象不会终止
Explicit,6,相容选择,弗吉尼亚州摒弃狄龙原则,或者弗吉尼亚州北部自成一州
Explicit,3,相关条件在先,如果你要沿用手机比喻,那么马里兰就应该有机会提出他们使用弗吉尼亚州北部的税收来管理交通的方法，作为立法机关提案的竞争备选方案。
Explicit,3,必要条件在先,除非人们有选择,否则这只是另一种使弗吉尼亚州北部永久地补贴弗吉尼亚州南部的福利制度的方法。
Explicit,6,互斥选择,你的批评应该针对那两个具体的拨款公式,而不是指向整个“立法机关”
Explicit,6,平行,免除它对华盛顿特区“内城”,以及所有那些讨厌的穷人的一切责任的安排
Explicit,2,结果在先,昨天，杰克逊被勒令关闭梦幻庄园，,因为他自２００５年底以来一直没有给庄园的４７名雇员付工资或保险费。
Explicit,4,间接对比,对没有拿到薪水的员工和被遗弃的羊驼来说，这很不幸，,但是也没有出人意外。
Explicit,1,先序,于去年６月去巴林“度假”，,至今尚未露面。
Explicit,5,递进,他讲述他父亲是如何让迈克尔参加深夜在旅馆房间与“重要商界人士”的会面，,并说他不知道在那些会面中是否会“有事发生”在迈克尔身上。
Explicit,2,推论在先,他说他感觉有些不对劲，,因为迈克尔后来总会病上几天。
Explicit,5,递进,人们看到家长与权势拉关系,并用子女来交换特权。
Explicit,5,递进,然而，我们也不应完全不信那个怀疑，,特别是考虑到迈克尔的一些超常兴趣和古怪的人际关系。
Explicit,1,同步,当盖勒和他的妻子在２００１年重誓婚约时，杰克逊是他的男傧相，,盖勒据说被重新启用为心灵间谍。
Explicit,2,结果在先,他古怪地讨厌自己的身体,怕自己长得象他的父亲。
Explicit,6,互斥选择,要么照我的方法,要么彻底消灭”
Explicit,4,间接对比,我没有找到切尼的“我们去打猎”来贴这个，,但是贴了．．．．．．
Explicit,4,让步在先,这可能牵涉到粗心大意，,但是这得由地方检察官来决定。
Explicit,1,先序,它们的一生在笼圈里度过，,然后在打猎的日子，它们被放了出来
Explicit,2,目的在后,然后在打猎的日子，它们被放了出来,目的纯粹是让迪克９９切尼及其一伙在它们飞向开阔的天空享受唯一短暂的几分钟自由时，作为纯粹的娱乐来杀死它们。
Explicit,3,充分条件在先,无论你是不是动物爱好者,这种打猎有一些令人恶心和卑劣的成分，而参加打猎的那些人也有些缺乏人性。
Explicit,5,递进,这种打猎有一些令人恶心和卑劣的成分，,而参加打猎的那些人也有些缺乏人性。
Explicit,5,实例在后,此外，在梦幻庄园／迪斯尼乐园和“米老鼠俱乐部”现已成明星的孩子们之间有着一些奇怪的联系,，包括贾斯汀·提姆布莱克（记得在珍娜９９杰克逊胸上的那颗星？）、布兰妮·斯皮尔斯、克里斯蒂娜·阿奎莱拉．．．．．．
Explicit,3,相关条件在先,如果人们看见你这副真面目，看见你坐着没事干，你喝酒，你咒骂，你［骂人话］滑稽可笑，满口脏话，你不是所有的时间都是那样的尖声尖气，,那他们就不会认为我是那么疯狂了
Explicit,5,递进,２０００年夏天在瑞士的一个巫毒教仪式中，那个巫术医生咒骂着迈克尔·杰克逊的敌人，,并祝福名誉受损的流行乐天王本人，许诺杰克逊仇人名单上的２５个人（不久将死去）．．．．．．
Explicit,5,解释说明,杰克逊已下令给当时他的财务顾问,驻首尔的在美国受过教育的韩人律师李明浩
Explicit,5,递进,这个据说欠债两亿四千万美元的流行乐歌星，付了六位数的巨款给另外一名巫毒教医生来举行使用羊血的净化仪式，,并且给一位名叫莎米娅的神秘埃及女人，她给他带来了一封一名高级沙特王子的问候信，据说是纳瓦夫·本·阿布杜拉·阿齐兹·萨乌德，现在的沙特阿拉伯情报局局长．．．．．．
Explicit,5,解释说明,它看中了乔治·梅森第四的庄园，,即位于北厄勒街２３０１号的“雪松”。
Explicit,4,让步在先,虽然关于皮鲁索的情况不太有人知道，,但是《洛杉矶时报》曾报道，曾与联谊会参议员拉尔夫·欧文·布鲁斯特争吵过的霍华德·休斯也住在那里。
Explicit,3,相关条件在先,如果权力和财富会让你变成这样,那我就万幸自己两者都没有。
Explicit,6,互斥选择,我的反应是迸发的愤怒，,而不是恐惧畏缩。
Explicit,1,先序,我打了他之后就跳起来跑进他的厨房抓起一把老式的大菜刀，跑回房间，,接着把我的伙伴踢醒，拖着他昏迷的身体离开了那该死的地方。
Explicit,2,原因在先,有一次，我的伙伴不能去取货，,所以我不得不去。
Explicit,1,先序,在我走之前，,他不得不向我解释他的供货人就是弗雷迪·费拉普。
Explicit,5,例外在后,他有一间房间保持空荡，,除了四角各有一支黑色的蜡烛。
Explicit,4,间接对比,我自己也思索这一点，,但是我得说，在我３０岁时，我可没有给１５岁的女孩们提供酒和乱摸人家。
Explicit,3,相关条件在先,如果他确实虐待‘他的’孩子们，如果他已被洗脑，,他是否犯有虐待“罪”呢？
Explicit,2,结果在先,这一招很有效，,因为许多人‘感觉’迈克尔·杰克逊尽管很天真，他不会干那些与恋童癖有关的邪恶活动。
Explicit,4,让步在先,迈克尔·杰克逊尽管很天真,他不会干那些与恋童癖有关的邪恶活动。
Explicit,2,推论在先,这有可能不是如此，,因为公开的‘形象’只是一个人格的‘另我’，而他可以有许多其他阴暗的‘人格’。
Explicit,3,相关条件在先,如果是这样的话,那么他们全都犯了这些虐待的罪，而他们同时是无辜的！
Explicit,2,原因在先,由于大多数虐待是一代传给一代的，,，这整个精神控制的主题真的必须公开。
Explicit,4,间接对比,想到过‘ＳＰＥＣＴＲＥ’，,但是那似乎太詹姆士·邦德化，就把它改为‘ＳＰＥＣＴＲＡ’。
Explicit,3,相关条件在先,如果说只有一样事情让我失望的话，,那就是这里所有的发帖人都喜欢匿名。
Explicit,3,相关条件在先,如果你愿意现身的话,用我简介那里的电子邮件地址联络我。
Explicit,3,相关条件在后,我想请你们参加ＦＳＨＯＤ，,如果这不算要求太多的话。
Explicit,2,结果在先,我很吃惊，我以前在任何地方都没有听人提过这个，,因为它和杰弗那个关于怪人杰克的小报帖子完全一致。
Explicit,4,间接对比,记不得那一期了，,但是珍娜在封面上
Explicit,4,间接对比,我记不清所有的细节,，但是一个是正常的流行音乐歌星珍娜，还有其他的，
Explicit,4,间接对比,一个真正的男人起码应该让一个前论坛成员读到他遭禁止的原因吧，,但是，我忘了我是在对付一个懦夫！
Explicit,4,间接对比,懦夫死千次，,但是英雄只死一次
Explicit,4,正向对比,与其说它是批评家们试图把它说成的滑稽可笑的意外，,我更认为必须把它看成是一个计划好的、蓄意的在全世界面前确确实实＋施行的一个巫术，并且日期和时间都具有练金术的重要意义。
Explicit,5,递进,我更认为必须把它看成是一个计划好的、蓄意的在全世界面前确确实实＋施行的一个巫术，,并且日期和时间都具有练金术的重要意义。
Explicit,2,目的在后,一位朋友甚至指出，在她更早的‘＋韵律国度’时期，在她录制的舞蹈里，她通常穿一身黑制服，使用古怪的＋阿谀奉承手势，那也是一种密语，意在传达一种特殊的信息，,以达到所想要的效果。
Explicit,1,同步,我在寻找一些东西来解释最近出丑的共和党商店窃贼克劳德.Ａ.艾伦的不正常情况时,，刚才又遇上了联谊基金会。
Explicit,4,间接对比,不能视其为百分之一百的可靠－－,但是在这件事里，它和目前的讨论如此对得上号，我暂时想相信它：
Explicit,2,原因在先,他给迪雷看了一盘录像，,使他痛哭流涕。
Explicit,5,解释说明,弗兰克·沃夫代表古老的“黑色行动”,，即称为联谊基金会的掠夺灵魂的机构。
Explicit,4,让步在先,虽然联谊会干的事几乎与国家安全局一样保密，,但是它确实有一样公共职能
Explicit,5,递进,它主持华盛顿一年一度的大型国会／总统祈祷早餐会，,并在五角大楼里和在其他政府和军队地点管理类似的活动。
Explicit,3,相关条件在先,如果他们合作,就可以统治世界。
Explicit,1,先序,汤姆·迪雷倒台之后,，查尔斯·柯尔生成了迪雷的私人宗教老师。
Explicit,2,原因在先,柯尔生激烈地主张对穆斯林进行“时代结束”一战，,这使他成了杰克·阿布拉莫夫志趣相投的伙伴，他们一起管理迪雷－－阿布拉莫夫多次带领汤姆去以色列号召向阿拉伯人全面开战。
Explicit,2,结果在先,之所以能产生如此强烈的恐惧,是因为你已经有了很强烈的被洗脑和被邪教行为所利用的经历。
Explicit,3,相关条件在先,如果你仔细看一下的话,，每一样与邪教行为有联系的事都＋同样可以在社会的行为里找到。
Explicit,3,相关条件在先,不遵循社会规则,你就不能生存
Explicit,3,相关条件在先,不遵守它的宗教信条,你就将进地狱
Explicit,1,同步,当农民工挣脱开来去触摸迈克尔时，,他们立刻就被士兵吞没了。
Explicit,5,递进,已被洗脑的歌迷们尖叫着，用一只手臂挥舞致意，,并以宗教的狂热点燃蜡烛。
Explicit,4,间接对比,到处都是标示着“流行音乐天王”的标牌，强调这“王”字，,而仅仅两年前，迈克尔才刚向欧普拉否认这个头衔。
Explicit,4,间接对比,最后，油布落了下来，当然啦，它是一个庞大的迈克尔铜像，两拳抗争性的紧握，他那颗星星的徽章很明显，,但是他的脸不知怎的依然如孩子一般，毫无威胁之感。
Explicit,5,递进,他膨胀的重要感不仅让人感到一阵寒意，,而且还咄咄逼人。
Explicit,4,间接对比,在他肩膀上有一种带星星的徽章，,但是有一点角度，不容易看清楚。
Explicit,4,间接对比,琐碎细节而已，,但是这里是‘ｓｔａｒｇｏｄｓ’对怪人杰克的综合分析：
Explicit,3,必要条件在先,只有政府,才能管理社会！
Explicit,3,充分条件在先,只要政府是一切的答案,那政府就会是一切。
Explicit,3,相关条件在先,如果人们不想要他们的孩子被＋骚扰，但是他们却把他们托付给‘穿袍子的男人’，,我真是不知道他们脑子里到底想的是什么？）
Explicit,4,间接对比,人们不想要他们的孩子被＋骚扰，,但是他们却把他们托付给‘穿袍子的男人’
Explicit,5,例外在后,我会当心那些彼得·潘的推测，,除非你知道你在讨论的是哪些版本，并且能精确地区分它们。
Explicit,5,递进,除非你知道你在讨论的是哪些版本，,并且能精确地区分它们。
Explicit,5,实例在后,我看到的一些假设,例如链接在此的去年贴子里蒂姆.鲍彻和梦幻行星提出的两个
Explicit,4,间接对比,我看到的一些假设（例如链接在此的去年贴子里蒂姆.鲍彻和梦幻行星提出的两个）看上去像是他们竭力地支持他们的论点，,但是其实和主要的彼得·潘神话联系甚微或根本没有。
Explicit,3,相关条件在先,如果你无法证实，,就不要编造什么彼得绑架儿童之类的事情。
Explicit,3,必要条件在后,要了解它对迈克尔.杰克逊实际意味着什么，以及你可以推测他在扮演什么角色,，你必须要知道他内心的彼得（不，不是那种彼得）在那些个彼得·潘的连续统一体里的位置。
Explicit,2,结果在先,他在出世七天后从家中逃了出来，,因为他记得在他变成人之前还是鸟儿时他会飞。
Explicit,5,递进,她必须记住彼得是一只鸟，,而且才出世一天。
Explicit,3,相关条件在先,如果一个坏的精灵发现了他们，或者他们在当夜冻死在黑暗的公园，,彼得就给他们掘墓并为他们做墓碑。
Explicit,3,相关条件在先,如果在七天之内无人认领他们，,“他们就被送往遥远的永无岛来偿还费用。”
Explicit,4,让步在先,虽然他们自己的生活比温蒂讲的童话要更奇异,但是他们要的却是一个母亲讲述的虚构故事。
Explicit,6,互斥选择,是温蒂引诱彼得让他和她在一起，,而不是反之。
Explicit,3,相关条件在先,如果你们中间那些持绑架理论的人愿意给出具体的引言以及有关在哪些地方可以看出彼得绑架了这些孩子的信息,就请劳驾了。
Explicit,6,相容选择,但是我认为你在根据一个现实中不存在的版本瞎编，,或者是一个无法和迈克尔.杰克逊联系上的版本。
Explicit,3,相关条件在后,我曾有机会问他们关于ＭＪ和虐待儿童的事，,就是如果他们知道什么的话。
Explicit,3,充分条件在先,无论他怎么说,他＋绝对不是一个耶证。
Explicit,4,间接对比,你可以在任何组织里找到虐待和‘有病’的人，,但是你必须＋要看到那和社会上其他人的比例。
Explicit,3,相关条件在先,如果他们听到任何虐待的事情，,他们必须遵信地方法律，地方法律通常要求他们尽快报告给警察。
Explicit,3,相关条件在先,如果虐待严重,就无论如何一定要报告警察。
Explicit,4,让步在先,虽然我不赞同他们所有的信仰,但是我和这些人很熟，足以称他们为朋友。
Explicit,3,相关条件在先,如果是那样的＋心态，,即使我们除掉了邪恶的精英分子，一批新的‘邪恶精英分子’会再次出来接替他们。
Explicit,4,让步在先,即使我们除掉了邪恶的精英分子,一批新的‘邪恶精英分子’会再次出来接替他们
Explicit,6,互斥选择,我们都应该去做力所能及的事，,而不要毫无必要地攻击无辜。
Explicit,4,间接对比,目前很少有了，,不过，你也许可以通过图书馆馆际互借找到一本来读一读。
Explicit,3,相关条件在先,如果你收听辛那屈的“我的方式”，,倒着听，答案就会显示出来。
Explicit,3,相关条件在后,但是告诉我，上尉，,如果你知道一个能立脚的体面地方
Explicit,4,让步在先,即使对那些试图关注战争犯罪迷雾里过滤出来的东西的人，,这些事情常常会凑在一起
Explicit,1,先序,处死了一家１１口人,然后炸了他们的房子，烧了他们的汽车，屠杀了他们的牲口。
Explicit,4,间接对比,他的说法没有根据也很＋极端，,但因为＋极端也能讲得通，为在伊拉克展现的暴行模式提供了样板。
Explicit,3,充分条件在先,不管怎样,麦克白已成了那些拒绝相信美军在进行恐怖计划的人的幸运护符，
Explicit,3,相关条件在先,如果有人要杀你全家,你也会说这不对，这不错，这只是？
Explicit,2,结果在先,难道我们就算了，说这种事没关系，,就因为‘目前的经济模式’这么说来着？
Explicit,2,结果在先,我可以感觉到日益增长的绝望,，因为人们意识到，只凭相信我们是在正义的一边可能并不一定会使它变为事实。
Explicit,4,让步在先,虽然被铁三角的宣传切除了脑白质,但是说中了我们大家都应该知道的一大要点。
Explicit,1,先序,那会是巨大的核攻击，使所有对手能动员起来之前就毁于＋烈焰之中，,用它的新式打仗科技把其他东西一扫光。
Explicit,4,间接对比,不是真的不可避免，,但是这样会让一个由世界最大私人资产公司的军事机构控制的政府统治起来容易得多。
Explicit,4,让步在先,虽然阴阳怪气,但却说得差不离了－－
Explicit,4,让步在先,虽然我不同意他／她的伦理道德观,但是目前在地球上有太多的人，
Explicit,3,相关条件在先,如果他们都想要有一辆车开着去商场－－＋很多人正开始动这个念头，,而按现在的情况看，这是不可能的。
Explicit,3,相关条件在先,如果我没有弄错的话,这儿说的问题正是那个计划所探讨的。
Explicit,4,让步在先,即使你与我们意见一致,你也可能会死得很惨。
Explicit,4,让步在后,但是你还是有一个机会,，尽管是一个较小的机会。
Explicit,5,实例在后,，美军官员们现在确信一支海军陆战队杀死了约２４名手无寸铁的伊拉克人，,包括妇女和六名儿童。
Explicit,3,相关条件在先,如果所有的战争不是“道德观崩溃”，,那这些官员究竟认为它们是什么呢？
Explicit,3,相关条件在先,如果有系统地屠杀数万或者数十万的人不代表“道德观崩溃”,那什么能代表呢？
Explicit,5,实例在后,难道我们要等一些重大犯罪，,比如在总统办公室里发生非法性行为？
Explicit,3,相关条件在先,如果同样的无辜者的同样死亡是由空投炸弹造成的，,那些为这些杀戮道歉的人会满意了吗？
Explicit,2,结果在先,在这个国殇日周末，美国人应该认识到他们支持这种疯狂是不道德的，,因为他们的政府正在经营着一个屠宰场。
Explicit,5,递进,这个周末也许是一个合适的机会来把这些标志从他们的汽车上，家里，,甚至更好的是从他们的心里清除掉！
Explicit,5,实例在后,美军官员们现在确信一支海军陆战队杀死了约２４名手无寸铁的伊拉克人，,包括妇女和六名儿童。
Explicit,3,相关条件在先,如果所有的战争不是“道德观崩溃”,那这些官员究竟认为它们是什么呢？
Explicit,3,相关条件在先,如果有系统地屠杀数万或者数十万的人不代表“道德观崩溃”，,那什么能代表呢？
Explicit,5,实例在后,难道我们要等一些重大犯罪，,比如在总统办公室里发生非法性行为？
Explicit,3,相关条件在先,如果同样的无辜者的同样死亡是由空投炸弹造成的,那些为这些杀戮道歉的人会满意了吗？
Explicit,2,结果在先,在这个国殇日周末，美国人应该认识到他们支持这种疯狂是不道德的，,因为他们的政府正在经营着一个屠宰场。
Explicit,5,递进,出于最基本的道德，这个周末也许是一个合适的机会来把这些标志从他们的汽车上，家里，,甚至更好的是从他们的心里清除掉！
Explicit,5,递进,我不光指从伊拉克返回的部队，,我指的是整个恶毒的死亡文化。
Explicit,1,先序,买了那个玩具的孩子,现在应该是二十五六或靠近三十岁了，可能已经有出征伊拉克一两趟的经验了。
Explicit,5,递进,造成这该死的状况的不是《杀死比尔》或那些电动游戏，,甚至也不是连环杀人犯玩具。
Explicit,6,互斥选择,说明为什么战争应该是最后一招，,而不是现在这种装饰着时髦图片的信息娱乐大片。
Explicit,4,间接对比,我当时一开始就觉得这是个坏主意，,但是我做了什么来阻止它吗？
Explicit,5,递进,不要为了勒索而恐吓人家,也不要冤枉任何人
Explicit,3,相关条件在先,一旦开了这个先例,，就没有退路了。
Explicit,2,原因在先,需要不断地恐吓，威胁人们，,使他们出于恐惧而被迫接受中国共产党的绝对统治。
Explicit,2,目的在先,为了使社会里始终存在“斗争”,就必须制造仇恨。
Explicit,5,递进,不仅中共杀人，,，它还鼓励人们互相残杀。
Explicit,5,递进,除了毁灭了无数生命之外,中共还毁灭了中国人民的灵魂。
Explicit,5,递进,他是布什表亲的丈夫，,也是骷髅会成员。
Explicit,5,递进,所以他们提拔并起用共产党人，,而共产党人其实想要摆脱作为达到统治世界的踏脚石的美国政府形式。
Explicit,1,先序,发现这些人是无辜的之后，,他们就被定于释放。
Explicit,5,递进,宣布不得批评总统或者是我们应该不分对错地支持总统不仅不是爱国,而是卑躬屈膝
Explicit,5,递进,他是布什表亲的丈夫，,是骷髅会成员。
Explicit,2,结果在先,也许毛＋这么做的全部理由是,因为他反对他在“雅礼会”里所学的东西。
Explicit,4,间接对比,可能是错的，,但是可能不是。
Explicit,5,解释说明,这样更容易以权力的名义施行暴力，,更容易让别人为你来这么做。
Explicit,6,互斥选择,要么是美军对平民施行暴力,要么是美国政府对（世贸中心、五角大楼和各架飞机里）本国和外国平民遭受的暴力犯有同谋罪或有责任。
Explicit,5,实例在后,其他确定事件,如那辆满载以色列人的面包车
Explicit,5,递进,然后，那个说法被戳穿为胡扯，,而且还是特别冒犯的胡扯，
Explicit,3,相关条件在先,如果你和一些在世贸中心事件里死去的犹太＋人有亲戚关系的话,就更为如此
