type,RelNO,content,Arg1_Content,Arg2_Content
Implicit,5,解释说明,按照会议提出的战略目标，明年的经济工作任务十分繁重，回顾这几年经济发展的历程最基本的经验，就是坚持用发展的办法解决前进中的问题。,只有使经济更快发展才能为解决各种社会经济问题保持稳定，促进社会全面发展和进步提供必要的物质条件，同时我们要不断在实践中摸索、总结、发现、验证市场经济的规律，买方市场条件下的规律，经济全球化时代的规律，掌握作好领导工作所必须的市场经济知识和科学技术知识，运用改革的办法，市场经济的办法来推进工作，增强按国际通行规则办事和依法行政的能力，加强对事关国民经济和社会发展全局重大关系的研究，掌握领导经济工作的主动权。
Implicit,5,解释说明,按照会议提出的战略目标，明年的经济工作任务十分繁重，回顾这几年经济发展的历程最基本的经验，就是坚持用发展的办法解决前进中的问题。,２００１年是新世纪的开端，也是十五计划的第一年，我们必须按照中央经济工作会议的部署，把握好六大问题，就是：坚持扩大内资的战略方针，继续实施积极的财政政策和稳健的货币政策，巩固和发展经济增长的好形势；把加强农业和增加农民收入放在经济工作的突出位置，继续推进农业和农村经济结构的战略性调整，加大对农业的支持和保护力度，加快农村税费改革和农村金融改革，减轻农民负担改善融资服务；加快体制改革和科技进步，推进经济结构的战略性调整，注意处理好高新技术产业与传统产业的关系、技术资金密集型产业与劳动密集型产业的关系，东部、中部发展与西部开发的关系；作好加入世界贸易组织的各项准备工作，迎接对外开放的新阶段；注意关心和解决好人民生活问题，多渠道扩大就业，推进建立社会保障体系的进程；加强精神文明建设，促进社会全面进步
Implicit,5,泛化,２００１年是新世纪的开端，也是十五计划的第一年，我们必须按照中央经济工作会议的部署，把握好六大问题，就是：坚持扩大内资的战略方针，继续实施积极的财政政策和稳健的货币政策，巩固和发展经济增长的好形势；把加强农业和增加农民收入放在经济工作的突出位置，继续推进农业和农村经济结构的战略性调整，加大对农业的支持和保护力度，加快农村税费改革和农村金融改革，减轻农民负担改善融资服务；加快体制改革和科技进步，推进经济结构的战略性调整，注意处理好高新技术产业与传统产业的关系、技术资金密集型产业与劳动密集型产业的关系，东部、中部发展与西部开发的关系；作好加入世界贸易组织的各项准备工作，迎接对外开放的新阶段；注意关心和解决好人民生活问题，多渠道扩大就业，推进建立社会保障体系的进程；加强精神文明建设，促进社会全面进步。,这一部署纵览全局、目标明确，各级党委和政府要认真学习领会，紧密结合实际扎扎实实抓好会议精神的贯彻落实。
Implicit,2,结果在先,在谈到大团结、大联合问题时李瑞环说，江泽民同志在讲话中指出，要巩固发展最广泛的爱国统一战线，就必须牢牢把握大团结、大联合这个主题。,大团结、大联合关系统一战线的根本，影响党和国家的全局。
Implicit,6,平行,在谈到大团结、大联合问题时李瑞环说，江泽民同志在讲话中指出，要巩固发展最广泛的爱国统一战线，就必须牢牢把握大团结、大联合这个主题。,在谈到统战部门的工作任务时李瑞环说，统一战线由提出到现在，经历了若干历史阶段，从总体上讲，它的法宝地位没有改变，就具体政策上说，有不少问题需要进行系统深入的研究，希望统战部门的同志多花一点时间读书，多花一点时间调查，多花一点时间琢磨问题，多花一点时间研究政策，多提出一些有价值的意见建议，要按照“三个代表”的要求，把统战工作提高到一个新的水平。
Implicit,5,解释说明,请听内蒙古台记者彭佩今天凌晨从矿区发来的报道,内蒙古大雁煤业公司１１·２５特大爆炸事故的抢险工作一直在紧张进行，但是由于坑道中不时有大量瓦斯涌出，抢险队几次受阻，推进速度减缓，到今天早上记者发稿时仍然没有找到新的遇难者。
Implicit,5,解释说明,对大雁煤矿为什么有大量瓦斯涌出的问题，记者采访了呼伦贝尔盟地震局局长韩久龙,“大雁煤矿覆盖在两条断裂带的交汇区，在１１·２５大爆炸前后的一段时间内，这两个断裂带上已经发生十几次三级以上的有感地震，其中四级以上地震有两次。据此我们分析认为，大雁煤矿发生的瓦斯突然大量涌出现象与地震活动密切相关，希望各级政府提高防震减灾意识，避免事故的发生。”
Implicit,2,证据在先,大雁煤矿覆盖在两条断裂带的交汇区，在１１·２５大爆炸前后的一段时间内，这两个断裂带上已经发生十几次三级以上的有感地震，其中四级以上地震有两次。,据此我们分析认为，大雁煤矿发生的瓦斯突然大量涌出现象与地震活动密切相关，希望各级政府提高防震减灾意识，避免事故的发生
Implicit,6,平行,据呼盟地震专家介绍，当地发生的多次地震距大雁矿区直线距离不到１００公里，而且大雁矿区在１１·２５大爆炸前后都出现过一些宏观异常现象，如地下水混浊，地面房屋出现裂缝，多次出现人感地震等等，都说明当地的断裂构造异常活跃。他们在调查报告中认为，地震活动是１１·２５大爆炸的重要因素之一。,矿山防爆专家认为，仅仅有大量瓦斯涌出还不能引起爆炸，如果有良好的通风，没有高温明火也不会引爆，那么引爆的高温明火是怎样产生的？
Implicit,4,间接对比,各位听众，１９９４年甘肃省蓝欣无线电厂全年亏损１４００万元，企业接近破产的边缘。,５年之后的１９９９年以蓝欣无线电厂为核心企业的蓝欣通讯设备集团有限公司全年盈利３０００万元，成为甘肃省电子行业的排头兵，预计今年将盈利５０００万。
Implicit,5,递进,５年之后的１９９９年以蓝欣无线电厂为核心企业的蓝欣通讯设备集团有限公司全年盈利３０００万元，成为甘肃省电子行业的排头兵，预计今年将盈利５０００万。,蓝欣集团是如何实现这一变化的？
Implicit,5,解释说明,王文歌认为只有转变观念，更新机制蓝欣才能再创辉煌。,“思想观念的转变呢，它是一个很具体的东西，我们也多次强调。它不是一个很抽象的说是我们之中大家学习组织学习就是转变思想观念了。那么思想观念呢必须要用相应的措施和制度，或者制度的创新来保证思想观念的转变。”
Implicit,2,结果在先,思想观念的转变呢，它是一个很具体的东西，我们也多次强调。,它不是一个很抽象的说是我们之中大家学习组织学习就是转变思想观念了。
Implicit,2,原因在先,王文歌认为只有转变观念，更新机制蓝欣才能再创辉煌。,蓝欣大刀阔斧的进行用人制度，分配制度、激励机制三项制度改革。
Implicit,5,解释说明,蓝欣大刀阔斧的进行用人制度，分配制度、激励机制三项制度改革。,在企业内部干部、工人的身份界限被打破，通过竞聘答辩公开招聘管理干部。
Implicit,5,解释说明,所以我们就首先定位，那么什么是市场经济？,市场经济就是首先你企业的一线不在企业的内部，是在企业的外部，是在市场上。
Implicit,5,递进,市场经济就是首先你企业的一线不在企业的内部，是在企业的外部，是在市场上。,销售人员、技术开发，搞技术产品，技术，这成为企业的一线。
Implicit,6,平行,从１９９５年开始，蓝欣提出了“抓两头，带整体”的激励政策，一头抓市场开拓，一头抓产品开发，形成哑铃形发展模式。,对销售人员实行保底不封顶的分配制度，年销售额达到５００万元奖励一套住房，对科技人员设立产品开发奖，有功人员还可以享受厂长津贴。
Implicit,5,递进,对销售人员实行保底不封顶的分配制度，年销售额达到５００万元奖励一套住房，对科技人员设立产品开发奖，有功人员还可以享受厂长津贴。,这几年蓝欣的主要技术人员年收入都在１０万元以上。
Implicit,5,解释说明,,“我们想用５年的时间，能够进入成为甘肃工业、经济效益能够排到前十位。十年呢，我们想在全国的５００强企业里能有我们一席之地。”
Implicit,6,平行,我们想用５年的时间，能够进入成为甘肃工业、经济效益能够排到前十位。,十年呢，我们想在全国的５００强企业里能有我们一席之地。
Implicit,5,解释说明,现在介绍全国媒体的部分内容,今天出版的《人民日报》，就在农村开展“三个代表”重要思想学习教育活动发表评论指出：今冬明春是开展学习教育的关键时期，要开好局，起好步，牢牢把握工作的主动权。
Implicit,6,平行,假药为什么屡禁不止呢？,造假者又为什么屡试不少呢？
Implicit,5,解释说明,造假者又为什么屡试不少呢？,《中国医药报》在深入剖析震惊全国的四川南冲假药案之后指出：贪官与奸商的狼狈勾结，造假与售假的沆瀣一气成为假药泛滥的原凶，打假必须正本清源，挖出为造假者撑腰的更大蛀虫。
Implicit,5,解释说明,造假者又为什么屡试不少呢？,蛀虫难防，粮耗子同样让人头痛，河南电台的消息说：在我们县委书记的榜样焦裕禄的故乡兰考县一个镇的粮管所几乎快被一群粮耗子掏空了家底。
Implicit,5,解释说明,蛀虫难防，粮耗子同样让人头痛，河南电台的消息说：在我们县委书记的榜样焦裕禄的故乡兰考县一个镇的粮管所几乎快被一群粮耗子掏空了家底。,１０多名粮所职工利用压秤坑农、虚开收购发票和磅码单等手段，造成粮库亏库小麦２０００多吨。
Implicit,5,解释说明,我国是家电生产消费的大国，面对使用多年已经报废掉的冰箱、洗衣机、电视机，我们至今还没有找到妥善处理的方法,家电材料中含有的各种有害化学物质正威胁着我们的生存环境，《中国电子报》载文呼吁不要对此等闲视之，要积极行动起来，不要让废电器毁了我们的明天。
Implicit,5,解释说明,“１０、９、８、７、６、５、４．．．．．．”１９９９年１０月２０号一枚新型长征运载火箭喷射着巨龙般的火焰，携带着我国第一艘太空实验飞船神州号飞向浩瀚无垠的太空，在这举世瞩目的成功背后，很少有人知道中建总公司８局的职工们在沙漠戈壁里苦战了３年，为我国建成了一座可上九天揽月的太空港。,中国太空港又称“９２１５２０工程”，位于巴丹吉林沙漠腹地，这里冬季最低温度零下３４度，盛夏地表温度高达７０度以上。
Implicit,2,原因在先,中国太空港又称“９２１５２０工程”，位于巴丹吉林沙漠腹地，这里冬季最低温度零下３４度，盛夏地表温度高达７０度以上。,在施工期间，“９２１５２０”工程项目部用细致入微的思想政治工作凝聚人心创造了奇迹。
Implicit,5,解释说明,在施工期间，“９２１５２０”工程项目部用细致入微的思想政治工作凝聚人心创造了奇迹。,施工队伍就要开进沙漠的时候，年近花甲的总工程师葭宏秋却因椎肩盘突出，寸步难行，工程局局长梁新相立即派车把葭总送到南京医治，病痛减轻后，梁局长又护送葭总踏上了开往酒泉工地的列车。
Implicit,2,原因在先,技术员郭玉琴第一次离开父母到艰苦岗位工作，思家心切、情绪低落，到工地的第三天恰逢小郭１８岁生日，夜幕降临之后，支部书记和经理端来了自制的生日蛋糕，郭玉琴流下了眼泪。,提起支部对自己的关心，郭玉琴激动不已。
Implicit,2,原因在先,治安科技术员朱守强和兰州姑娘刘桂芳约定春节结婚，可是由于工程需要，他离不开工地，春节前他写信要求把婚期推迟到五一节，谁知信件在途中又耽搁了，不知内情的刘桂芳一气之下嫁给了他人。,朱守强婚姻受挫的消息传到工地，党员干部纷纷给他宽心，党支部书记常俊峰发动大家帮朱守强找对象，终于在酒泉基地找到了一位与朱守强志同道合的好姑娘，从此朱守强一心扑在工作上，成了太空港建设工地上的拼命三郎。
Implicit,5,泛化,朱守强婚姻受挫的消息传到工地，党员干部纷纷给他宽心，党支部书记常俊峰发动大家帮朱守强找对象，终于在酒泉基地找到了一位与朱守强志同道合的好姑娘，从此朱守强一心扑在工作上，成了太空港建设工地上的拼命三郎。,中建总公司８局“９２１５２０”项目部的党组织，就是靠一场场思想政治工作的细雨，滋润着职工们的心田，使那雄伟壮丽的太空港矗立在祖国大西北的戈壁滩上。
Implicit,5,解释说明,２０００年是实现一控双达标的决战之年，各地加大了污染防治的力度，努力将一控双达标工作落到实处。,据各省、自治区、直辖市上报的数据统计，全国２３．８万家工业污染企业中９７．７％实现了达标排放，其中治理达标的占８０．１％，关停的占１７．６％，１．８万家重点污染企业中有９３．６％实现了达标排放。
Implicit,5,解释说明,但是国家环保总局局长解振华在正在北京召开的全国环保工作会议上宣布：全国工业污染源达标率为９０％，重点污染企业达标率在８５％以上。,他说考虑到有的企业关停是由于市场因素所至，有的企业属于突击达标，治理技术、设备不过关，存在反弹可能，再加上环保监测、监控能力跟不上等因素，压缩达标率力求比较客观和实事求是。
Implicit,6,平行,记者高则成报道，今年元旦刚过，河北省委省政府下发了关于减轻农民负担的一号文件，通知要求各地各部门要加强领导，实行一票否决制度，对强行要求农民以资代劳的１１种行为要追究有关责任人的责任，各地征收税费要实行征收内容、征收标准和数量、征收方法减免规定、征收结果等内容的公开，对于农村中小学乱收费问题近期要开展一次全面清理。,记者才让多杰报道，去年青海省先后制定出台了一系列减轻农民负担的政策性文件，对村提留、乡统筹费的提取管理和农牧业税收征管提出具体规定。
Implicit,6,平行,目前青海省有９０％的乡村建立了村提留、乡统筹费预决算和农牧民负担监督卡制度。,８０％的乡村开展了对农牧民负担的专项审计，有效的保证了“三提五统”资金的管理和使用。
Implicit,6,平行,记者沈剑华报道，为减轻农民负担，吉林省决定从今年起到税费改革前，全省停止一切向农民筹资的公益事业，省委书记王云坤要求全省上下真抓实干，把增加农民收入作为全省农村工作的根本出发点和落脚点。,记者才让多杰报道，去年青海省先后制定出台了一系列减轻农民负担的政策性文件，对村提留、乡统筹费的提取管理和农牧业税收征管提出具体规定。
Implicit,5,解释说明,广东发展农业外向型经济有政策优势、地源优势和资源丰富三大优势，在分析这些优势的基础上广东提出扩大农业投资领域，鼓励外资带片开发荒山和滩涂，建立较大规模的农产品生产和加工出口体系。,广东省委、省政府清醒的认识到，有优势还要有良好的科技基础才能彻底摆脱粗放经营的局面。
Implicit,5,解释说明,广东省委、省政府清醒的认识到，有优势还要有良好的科技基础才能彻底摆脱粗放经营的局面,省科技厅副厅长罗复何说，“过去农民生产的产品就摆在地摊上等着人家来买，这种落后的生产方式制约了农产品的出口，因为只有按照国际要求的食品的标准来提高我们的技术，改进我们整个产业的链条，使产品都达到这个标准才有可能出口。
Implicit,5,解释说明,广东省委、省政府清醒的认识到，有优势还要有良好的科技基础才能彻底摆脱粗放经营的局面。,农药的使用上广东从过去的化学剂杀虫转入了植物剂杀虫尽量减少污染，这一成果在世界上处于领先的地位。
Implicit,5,解释说明,广东省委、省政府清醒的认识到，有优势还要有良好的科技基础才能彻底摆脱粗放经营的局面,广东荔枝过去由于无法攻破保鲜技术，使得无法进入国际市场，在广东科技厅的组织下解决了这一难题
Implicit,6,平行,省科技厅副厅长罗复何说，“过去农民生产的产品就摆在地摊上等着人家来买，这种落后的生产方式制约了农产品的出口，因为只有按照国际要求的食品的标准来提高我们的技术，改进我们整个产业的链条，使产品都达到这个标准才有可能出口。,农药的使用上广东从过去的化学剂杀虫转入了植物剂杀虫尽量减少污染，这一成果在世界上处于领先的地位
Implicit,6,平行,农药的使用上广东从过去的化学剂杀虫转入了植物剂杀虫尽量减少污染，这一成果在世界上处于领先的地位,广东荔枝过去由于无法攻破保鲜技术，使得无法进入国际市场，在广东科技厅的组织下解决了这一难题。
Implicit,5,实例在后,广东荔枝过去由于无法攻破保鲜技术，使得无法进入国际市场，在广东科技厅的组织下解决了这一难题,去年有３０００吨广东荔枝走进了国际市场，打破了以色列、澳洲的荔枝一统国际市场的局面。
Implicit,5,实例在后,广东发展农业外向型经济有政策优势、地源优势和资源丰富三大优势，在分析这些优势的基础上广东提出扩大农业投资领域，鼓励外资带片开发荒山和滩涂，建立较大规模的农产品生产和加工出口体系,广州立志实业有限公司集种植、加工、贸易为一体，平均每天出口蔬菜２０００吨，每年创汇１００万美元
Implicit,6,平行,去年有３０００吨广东荔枝走进了国际市场，打破了以色列、澳洲的荔枝一统国际市场的局面。,广州立志实业有限公司集种植、加工、贸易为一体，平均每天出口蔬菜２０００吨，每年创汇１００万美元
Implicit,5,泛化,广州立志实业有限公司集种植、加工、贸易为一体，平均每天出口蔬菜２０００吨，每年创汇１００万美元。,外向型经济成为广东农业和农村经济发展的新增长点
Implicit,5,解释说明,经济部作出了不建核试的报告，不过行政院长唐飞的态度似乎还是稍有保留。,他表示这只是经济部的意见，并不代表就是行政院的最后决定。
Implicit,5,解释说明,他表示这只是经济部的意见，并不代表就是行政院的最后决定。,行政院长唐飞上午７点多钟就抵达行政院，除了召开财经会谈之外，在经济部作出替代方案代替核试新建的建议之后，行政院的动态也备受瞩目。
Implicit,5,解释说明,而唐飞却在稍后回应指出，目前只是经济部的建议，并不能够代表行政院的最后决策。,“经济部提出不续建核试的建议呢，是代表经济部的立场，所做的决定判断，可能还没有考虑到社会、政治、法律和其它很多的因素。我们可能要到１０月的中旬的后半期到下旬之前，各部的首长，有关部的首长才有时间对这个报告，对很多的报告做一个深入的了解。”
Implicit,2,原因在先,经济部提出不续建核试的建议呢，是代表经济部的立场，所做的决定判断，可能还没有考虑到社会、政治、法律和其它很多的因素。,我们可能要到１０月的中旬的后半期到下旬之前，各部的首长，有关部的首长才有时间对这个报告，对很多的报告做一个深入的了解。
Implicit,6,平行,奥运就要在明天正式的闭幕了，而到目前为止，各个国在奥运的奖牌统计数方面呢分别是：美国，还是排名第一，总计是８１面奖牌；而大陆也拿到了２６面金牌暂居第二。,澳洲和法国还是并列第４名和第５名。
Implicit,5,解释说明,台北今天发生了母亲被儿子乱刀砍死的悲剧。,２５岁的简明宜可能是因为没有钱吸毒和他的母亲发生了争执，竟然狠下毒手，他的母亲身中７刀。
Implicit,5,解释说明,这也难怪。,嫌犯２５岁退伍回来后，就让家人伤透脑筋，而他始终无法戒掉毒瘾，现在又因为一次要不到买毒品的钱，杀了母亲。
Implicit,5,例外,台北县三重警方昨天深夜出动了１００名的警力一口气破获了６家没有执照的私娼馆，找到了２５名的私娼，展现了警方打击色情的决心。,画面中这一栋栋只有两层高的房子不晓得的人还以为是普通住户，不过当地的居民都知道这里就是人称‘台北县华氏街老瓜处’。
Implicit,5,解释说明,画面中这一栋栋只有两层高的房子不晓得的人还以为是普通住户，不过当地的居民都知道这里就是人称‘台北县华氏街老瓜处’。,来这里交易的客人大多都是外劳，工人或者是计程车司机，交易一次的价格只要１０００元，因此每到晚上客人是络绎不绝，生意好的不得了。
Implicit,5,递进,但是这些建物不但是违建，里面的人也全都是没有执照的私娼。,警方昨天深夜由检察官亲自率队直捣黄龙，一口气冲了６家，逮捕２５名私娼以及负责人。
Implicit,5,解释说明,警方昨天深夜由检察官亲自率队直捣黄龙，一口气冲了６家，逮捕２５名私娼以及负责人。,这些私娼从２０多岁到５０多岁都有，有人甚至１０几年前就在这里下海卖淫，把这里当成自己的家。
Implicit,5,递进,这些私娼从２０多岁到５０多岁都有，有人甚至１０几年前就在这里下海卖淫，把这里当成自己的家。,老瓜处即将在下个月被拆除，警方这次展现公权力，目的就是要防止色情业者再流窜到别的地方继续营业。
Implicit,5,解释说明,不过从现场的迹象来看，这名女子应该有他杀的嫌疑。,出事地点是在和平西路二段１１号，一栋大楼后侧的一楼停车场，死者现年大约２０多岁的年青女子。
Implicit,5,递进,出事地点是在和平西路二段１１号，一栋大楼后侧的一楼停车场，死者现年大约２０多岁的年青女子。,被人发现时候仰躺在地上，双手上举，但是已经没有气息。
Implicit,5,递进,不过当时到底怎么发生的，全都没有人知道。,初步研判，死者应该是他杀，警方目前正在进行查访，了解这名女子成分，并且派驻人员到现场详细采证。
Implicit,5,递进,台北市警方今天逮捕了一名连续在大楼以送瓦斯员工作掩护的男子，而涉嫌连续强暴案，在一年之内他连续已经做了有４件以上，而其中有３件都是在同一栋大楼里做下的。,现年３４岁的嫌犯王东志被警方带回时还羞愧的用手遮脸，不过他仍然无法掩饰自己辣手摧花，连续犯下强暴案件的可耻罪行。
Implicit,5,解释说明,现年３４岁的嫌犯王东志被警方带回时还羞愧的用手遮脸，不过他仍然无法掩饰自己辣手摧花，连续犯下强暴案件的可耻罪行。,王东志涉嫌利用送瓦斯到住家的工作之便，一年之内连续潜入并且藏匿于大安区基隆路二段这栋大楼之内。
Implicit,5,解释说明,王东志涉嫌利用送瓦斯到住家的工作之便，一年之内连续潜入并且藏匿于大安区基隆路二段这栋大楼之内。,嫌犯看准了大楼电梯内没有装设监视器，他因此借着自己的水电专长，先将电梯上下楼按钮箭头对调，然后再戴着口罩和手套进入电梯里，专门找单身夜归女子下手。
Implicit,5,泛化,他先将被害人带到大楼内无人住宅，或是办公的空楼层，再加以强暴。,一年多之内，他在这栋大楼里面已经连续得逞了３次。
Implicit,5,递进,嫌犯另外在复兴南路的一栋旧大楼里面也强暴一名单身女子。,被警察带回时，他一度否认自己的罪行，直到警方ｄｎａ比对结果完全吻合，好色的嫌犯这才坦诚他就是警方布线追踪已久的‘电梯之狼’。
